<?xml version="1.0" encoding="UTF-8"?>
<!ELEMENT files (file+)>
<!ELEMENT file (name, type, size, description, link)>
<!ELEMENT name (#PCDATA)>
<!ELEMENT type (#PCDATA)>
<!ELEMENT size (#PCDATA)>
<!ELEMENT description (#PCDATA)>
<!ELEMENT link (#PCDATA)>
<!ATTLIST file id CDATA #REQUIRED>